{
  "decision_sha256": "db1b19f2a5107a0e6f154b55c008e813e90558f2a8ea59d2eb075ba4b4a80a37",
  "disclaimer": "Analytic proxy selection only; downstream SPICE simulation is required.",
  "proxy_metrics": {
    "area_um2": 14.683281572999746,
    "bandwidth_mhz": 868.7191389662019,
    "gain_db": 24.653515379657684,
    "phase_margin_deg": 54.22222222222222,
    "power_mw": 0.11160000000000003
  },
  "schema": "org.biasweave.sizing-decision",
  "selection": {
    "algorithm": "biasweave",
    "budget": 64,
    "point_key": "b18a4dea3812c8c6faa4f34ee2f271a90210c84ee51fdf07aa6ae73dd253b31b",
    "policy": "normalized-l1-to-observed-ideal-v1",
    "seed": 17
  },
  "source": {
    "benchmark_sha256": "7f128312cad0b25b73a0c73e19ebd3fed8841428a237a8145f4d9699d3989214",
    "comparison_sha256": "0ddea03930d816f8c8ef450e6be419518b68881704e02ae304ecc642925bf147",
    "topology_id": "TL-00052f7b8c5e",
    "topology_signature": "086ce3f4158fa05ea8fddf2e7552af1d9774f95faffbe4dee11fae262d8857c8"
  },
  "variables": {
    "bias_ua": 50.000000000000014,
    "compensation_pf": 1.0,
    "length_um": 0.6,
    "width_um": 4.472135954999578
  },
  "version": 1
}
